{
  "$schema": "https://json-schema.org/draft/2020-12/schema",
  "$id": "https://github.com/senthilsweb/ai-dlc-fp-estimation/data/schema/metadata.schema.json",
  "title": "FP Estimator dataset metadata.json",
  "description": "Schema for data/<app-name>/metadata.json. This documents the shape server/handler/data.go and app/index.html actually consume, including which fields are truly required vs which have a safe fallback when omitted, null, or empty. It is a documentation/IDE-validation aid (reference it via a \"$schema\" key in your metadata.json for editor autocomplete/validation) \u2014 it is NOT enforced at runtime; the server and app are deliberately tolerant of missing optional fields (see docs/adr/0007-json-schema-for-dataset-validation.md).",
  "type": "object",
  "required": [
    "projectConfig"
  ],
  "properties": {
    "$schema": {
      "type": "string",
      "description": "Point this at ../schema/metadata.schema.json (relative to your data/<app-name>/ folder) for IDE validation."
    },
    "version": {
      "type": "string",
      "description": "Optional. Shown in the footer as 'vX.Y.Z'; falls back to '1.0.0' if omitted."
    },
    "createdDate": {
      "type": "string",
      "description": "Optional, informational only."
    },
    "lastUpdated": {
      "type": "string",
      "description": "Optional, informational only \u2014 not currently rendered."
    },
    "description": {
      "type": "string",
      "description": "Optional. Not rendered directly; projectSummary.description is what's shown on the Project tab."
    },
    "projectSummary": {
      "type": "object",
      "description": "Optional. Omit entirely to show a generic empty-state on the Project tab instead of the hero/overview cards.",
      "properties": {
        "logo": {
          "type": "string",
          "description": "Optional Iconify icon name (e.g. 'mdi:rocket-launch'). Falls back to a generic rocket icon."
        },
        "logoColor": {
          "type": "string",
          "description": "Optional CSS color for the logo icon. Falls back to white."
        },
        "name": {
          "type": "string",
          "description": "Optional. Falls back to metadata.brandPrefix, then 'Project'."
        },
        "tagline": {
          "type": "string",
          "description": "Optional. Falls back to an empty string (hero renders with no subtitle)."
        },
        "description": {
          "type": "string",
          "description": "Optional. Falls back to 'No description available.'"
        },
        "techStack": {
          "type": "array",
          "items": {
            "type": "string"
          },
          "description": "Optional. Omit, null, or [] all correctly hide the Technology Stack block (no empty header shown)."
        },
        "businessContext": {
          "type": "object",
          "description": "Optional in full.",
          "properties": {
            "industry": {
              "type": "string",
              "description": "Optional. Industry line is hidden entirely if omitted."
            },
            "targetUsers": {
              "type": "array",
              "items": {
                "type": "string"
              },
              "description": "Optional. Omit, null, or [] correctly hide the Target Users block."
            },
            "valuePropositions": {
              "type": "array",
              "items": {
                "type": "string"
              },
              "description": "Optional. Omit, null, or [] correctly hide the Value Propositions block."
            }
          }
        },
        "links": {
          "type": "object",
          "description": "Optional. Only recognized keys render a button; unknown keys are ignored.",
          "properties": {
            "liveDemo": {
              "type": "string",
              "format": "uri"
            },
            "figma": {
              "type": "string",
              "format": "uri"
            },
            "github": {
              "type": "string",
              "format": "uri"
            },
            "documentation": {
              "type": "string",
              "format": "uri"
            },
            "website": {
              "type": "string",
              "format": "uri"
            }
          }
        },
        "keyJourneys": {
          "type": "array",
          "description": "Optional. Omit, null, or [] correctly hide the 'Core User Journeys' card entirely. Each entry's own 'steps' is independently optional \u2014 a journey with no steps renders 'No steps defined for this journey.' instead of breaking the page.",
          "items": {
            "type": "object",
            "required": [
              "name"
            ],
            "properties": {
              "name": {
                "type": "string",
                "description": "Required per-journey (falls back to 'Untitled journey' if somehow absent)."
              },
              "icon": {
                "type": "string",
                "description": "Optional Iconify icon name. Falls back to 'mdi:walk'."
              },
              "steps": {
                "type": "array",
                "items": {
                  "type": "string"
                },
                "description": "Optional. Omit, null, or [] renders a 'No steps defined' placeholder for that one journey card \u2014 it no longer crashes the whole app (fixed 2026-07-22; previously an absent/null 'steps' threw and blanked every section, not just this card)."
              }
            }
          }
        }
      }
    },
    "projectConfig": {
      "type": "object",
      "description": "Required. This is the one object the server treats as authoritative for branding/FP defaults/product list.",
      "required": [
        "products"
      ],
      "properties": {
        "title": {
          "type": "string",
          "description": "Optional, informational (not directly rendered)."
        },
        "mainProductName": {
          "type": "string",
          "description": "Optional, informational (not directly rendered)."
        },
        "brandPrefix": {
          "type": "string",
          "description": "Optional but strongly recommended \u2014 drives the page title and the Excel/PDF export filename prefix. Falls back to 'FP'. Note the app footer is deliberately product-branded and does NOT use this."
        },
        "organization": {
          "type": "string",
          "description": "Optional, informational only."
        },
        "defaultHourlyRate": {
          "type": "number",
          "description": "Optional. Falls back to 75. Seeds the Rate/hr input, which the user can then override live."
        },
        "defaultPDR": {
          "type": "number",
          "exclusiveMinimum": 0,
          "description": "Optional. NOMINAL hours per Function Point \u2014 the human baseline BEFORE any AI adjustment (conventionally ~8 for human-driven enterprise work). Falls back to 8. Must NOT be pre-discounted for AI: the app composes effective PDR = defaultPDR x product(active productivityFactors), so an AI discount baked in here would double-count against those factors. Express AI speedup in productivityFactors instead. Seeds a live input in Effort & Cost."
        },
        "currency": {
          "type": "string",
          "description": "Optional. Falls back to 'USD'. Not currently rendered as a symbol \u2014 informational."
        },
        "hoursPerDay": {
          "type": "number",
          "description": "Optional. Falls back to 8."
        },
        "daysPerMonth": {
          "type": "number",
          "description": "Optional. Falls back to 20."
        },
        "levels": {
          "type": "object",
          "description": "Optional. Names for the three hierarchy tiers, e.g. AI-DLC {\"1\":\"Intent\",\"2\":\"Bolt\",\"3\":\"Unit of Work\"} or classic WBS {\"1\":\"Product\",\"2\":\"Feature\",\"3\":\"Capability\"}. Each tier may be a plain string (plural is derived automatically) or {\"singular\":\u2026,\"plural\":\u2026} when the derived plural would be wrong (e.g. \"Unit of Work\" -> \"Units of Work\"). Falls back to classic WBS. Purely presentational: it renames tiers everywhere in the UI and changes no number. A viewer can also override it live from the header Terms selector to re-present the same estimate for a different audience. (Before 2026-07-22 this field was passed through by the server but never read by the app.)"
        },
        "products": {
          "type": "array",
          "description": "Required, and must be non-empty for a meaningful dataset (an empty list renders 'No products defined').",
          "items": {
            "type": "object",
            "required": [
              "dataFile"
            ],
            "properties": {
              "shortCode": {
                "type": "string",
                "description": "Optional. Shown under the product name on the Project tab; falls back to the product JSON's own 'id' field, then nothing."
              },
              "description": {
                "type": "string",
                "description": "Optional. Not currently surfaced separately from the product JSON's own content."
              },
              "dataFile": {
                "type": "string",
                "description": "Required \u2014 filename (relative to this dataset's folder) of the product JSON to merge in. A missing/unreadable file is silently skipped (matches the prior combine-wbs.js behavior) \u2014 the product just won't appear, with no error surfaced to the UI. Double-check this if a product goes missing."
              }
            }
          }
        }
      }
    },
    "fpConfig": {
      "type": "object",
      "description": "Optional in full \u2014 omit and the server defaults every field below.",
      "properties": {
        "fpWeights": {
          "type": "object",
          "description": "Optional. Falls back to {} (all capabilities compute 0 FP if this is empty \u2014 the totals will just be 0, not an error)."
        },
        "gscDefinitions": {
          "type": "array",
          "description": "Optional. If omitted, null, or [], the app falls back to the standard IFPUG 14-factor list (fixed 2026-07-22 \u2014 previously this dataset field was defined but silently ignored; the app always used its own hardcoded 14, discarding any dataset-authored defaults).",
          "items": {
            "type": "object",
            "required": [
              "id",
              "name"
            ],
            "properties": {
              "id": {
                "type": "integer"
              },
              "name": {
                "type": "string"
              },
              "description": {
                "type": "string"
              },
              "default": {
                "type": "integer",
                "minimum": 0,
                "maximum": 5,
                "description": "Optional GSC default rating (0-5). Falls back to 0 if absent."
              }
            }
          }
        },
        "vafBase": {
          "type": "number",
          "description": "Optional. Base term of the Value Adjustment Factor formula: VAF = vafBase + (vafIncrement x TDI). Falls back to the IFPUG standard 0.65. Changing it means results are no longer IFPUG-conformant. Exposed as a live input under Effort & Cost > Advanced."
        },
        "vafIncrement": {
          "type": "number",
          "description": "Optional. Per-TDI-point term of the VAF formula. Falls back to the IFPUG standard 0.01, which bounds adjustment to +/-35% across the 14 GSC factors."
        }
      }
    },
    "effortConfig": {
      "type": "object",
      "description": "Optional in full.",
      "properties": {
        "techStackFactors": {
          "type": "object",
          "description": "Optional. Map of {key: {label, icon}}. DOCUMENTATION ONLY \u2014 populates the Technology Stack selector and the Tech Stack tab, and is intended to be carried into generated proposals/SOWs. It does NOT affect hours or cost by design; effort is driven by nominal PDR and productivityFactors alone. (A `factor` field used to exist here and was removed 2026-07-22 \u2014 it never fed the math and was misleading.)"
        },
        "productivityFactors": {
          "type": "object",
          "description": "Optional. Map of {key: {label, factor, description}}. Rendered as checkboxes in Effort & Cost; EVERY checked entry's `factor` multiplies into effective PDR (multi-select, they compound). Values below 1 reduce effort, above 1 increase it. None are active by default \u2014 the user opts in. These are where the AI speedup belongs: keep `defaultPDR` at the human baseline and express agent-led gains here, so the discount has one source of truth and stays separately calibratable. Use vendor-neutral labels ('AI Agent-Assisted', 'AI Agent-Led'), not product names. (Before 2026-07-22 these were displayed but never applied.)"
        },
        "sdlcPhases": {
          "type": "array",
          "description": "Optional. If omitted or null, the app falls back to its own built-in SDLC phase breakdown (a hardcoded default list in app/index.html) rather than erroring.",
          "items": {
            "type": "object",
            "required": [
              "percentage"
            ],
            "properties": {
              "id": {
                "type": "string"
              },
              "name": {
                "type": "string"
              },
              "percentage": {
                "type": "number"
              },
              "icon": {
                "type": "string"
              },
              "color": {
                "type": "string"
              }
            }
          }
        }
      }
    },
    "statusDefinitions": {
      "type": "object",
      "description": "Optional. Keys are status ids used on capabilities (e.g. 'completed', 'partial', 'in-progress', 'roadmap', 'beta'). If omitted entirely, the status legend falls back to generic English labels ('Completed', 'Partial', etc.) for every key.",
      "additionalProperties": {
        "type": "object",
        "properties": {
          "label": {
            "type": "string",
            "description": "Drives the status-legend filter text. This is the field that lets a dataset relabel e.g. 'roadmap' as 'Build New'."
          },
          "description": {
            "type": "string"
          },
          "icon": {
            "type": "string"
          }
        }
      }
    },
    "glossary": {
      "description": "Optional \u2014 array or object, rendered as-is on the Glossary tab. Omit to show that tab empty.",
      "type": [
        "array",
        "object",
        "null"
      ]
    }
  }
}
